{
  "schema_version": "0.8.0",
  "diff_id": "diff_9cd652dc",
  "generated_at": "2026-05-21T15:09:35.628Z",
  "baseline_run_id": "run_2026-05-21T15-09-35-569Z_33e6",
  "current_run_id": "run_2026-05-21T15-09-35-626Z_bbe5",
  "summary": {
    "total_baseline": 11,
    "total_current": 11,
    "added_count": 0,
    "removed_count": 0,
    "changed_count": 0,
    "unchanged_count": 11
  },
  "added_findings": [],
  "removed_findings": [],
  "changed_findings": [],
  "unchanged_findings": [
    {
      "finding_id": "find_env_j4ab5b07",
      "category": "AI Credential",
      "severity": "high",
      "detector": "env-var-detector",
      "rule_id": "rule_env_openai",
      "matched_name": "OPENAI_API_KEY",
      "file_path": ".env.example",
      "evidence_hint": "Detected environment variable usage on line 6: 'OPENAI_API_KEY=your-openai-api-key-here'",
      "recommended_review": "Never hardcode API keys. Verify that this key is supplied securely at runtime via secrets manager (AWS Secrets Manager, Doppler, etc.)."
    },
    {
      "finding_id": "find_env_qokz2yt8",
      "category": "AI Credential",
      "severity": "high",
      "detector": "env-var-detector",
      "rule_id": "rule_env_anthropic",
      "matched_name": "ANTHROPIC_API_KEY",
      "file_path": ".env.example",
      "evidence_hint": "Detected environment variable usage on line 7: 'ANTHROPIC_API_KEY=placeholder-value-for-anthropic-key'",
      "recommended_review": "Ensure API key is removed from repository commits immediately. Verify secrets distribution mechanism."
    },
    {
      "finding_id": "find_dep_3jk4hfpv",
      "category": "AI SDK",
      "severity": "medium",
      "detector": "dependency-detector",
      "rule_id": "rule_dep_openai",
      "matched_name": "openai",
      "file_path": "package.json",
      "evidence_hint": "Detected 'openai': '^4.20.0' in package.json dependencies list.",
      "recommended_review": "Verify usage complies with company data privacy policy. Ensure no proprietary data is sent to external LLMs without explicit authorization."
    },
    {
      "finding_id": "find_dep_kl9a5s1i",
      "category": "AI Framework",
      "severity": "medium",
      "detector": "dependency-detector",
      "rule_id": "rule_dep_langchain",
      "matched_name": "langchain",
      "file_path": "package.json",
      "evidence_hint": "Detected 'langchain': '^0.0.198' in package.json dependencies list.",
      "recommended_review": "LangChain pipelines dynamically construct chains. Trace all active prompts and integrations to ensure there are no un-monitored model connections."
    },
    {
      "finding_id": "find_prompt_a7161yyz",
      "category": "AI Prompt Artifact",
      "severity": "low",
      "detector": "prompt-file-detector",
      "rule_id": "rule_prompt_artifact",
      "matched_name": "system.prompt.md",
      "file_path": "prompts/system.prompt.md",
      "evidence_hint": "Prompt artifact matched pattern: '\\.(prompt|prompts|system-prompt)\\.(md|txt|json|yaml)$' (File name: 'system.prompt.md')",
      "recommended_review": "Review prompt content to verify there are no hidden jailbreak vulnerabilities, bias, or leakage risks. Ensure user instructions are sanitised."
    },
    {
      "finding_id": "find_dep_5mxlf8a1",
      "category": "AI Framework",
      "severity": "medium",
      "detector": "dependency-detector",
      "rule_id": "rule_dep_llamaindex",
      "matched_name": "llama-index",
      "file_path": "requirements.txt",
      "evidence_hint": "Detected 'llama-index' on line 2 of requirements.txt: 'llama-index>=0.8.0'",
      "recommended_review": "LlamaIndex connects files to LLMs. Audit all document parsing pipelines and local index stores to prevent leaking restricted intellectual property."
    },
    {
      "finding_id": "find_dep_zl81iuoe",
      "category": "Vector DB",
      "severity": "medium",
      "detector": "dependency-detector",
      "rule_id": "rule_dep_chroma",
      "matched_name": "chromadb",
      "file_path": "requirements.txt",
      "evidence_hint": "Detected 'chromadb' on line 3 of requirements.txt: 'chromadb==0.4.15'",
      "recommended_review": "Ensure persistent database directories are located in secure environments. Block unauthorized exports."
    },
    {
      "finding_id": "find_env_jtv8js3l",
      "category": "AI Credential",
      "severity": "high",
      "detector": "env-var-detector",
      "rule_id": "rule_env_openai",
      "matched_name": "OPENAI_API_KEY",
      "file_path": "src/example.js",
      "evidence_hint": "Detected environment variable usage on line 5: 'const apiKey=proc...[REDACTED]'",
      "recommended_review": "Never hardcode API keys. Verify that this key is supplied securely at runtime via secrets manager (AWS Secrets Manager, Doppler, etc.)."
    },
    {
      "finding_id": "find_vector_ipk85m4u",
      "category": "Vector DB",
      "severity": "medium",
      "detector": "vector-db-detector",
      "rule_id": "rule_dep_chroma",
      "matched_name": "Chroma DB",
      "file_path": "src/example.js",
      "evidence_hint": "Detected vector database library reference on line 2: 'import { ChromaClient } from 'chromadb';'",
      "recommended_review": "Ensure persistent database directories are located in secure environments. Block unauthorized exports."
    },
    {
      "finding_id": "find_vector_t7rnr7fm",
      "category": "Vector DB",
      "severity": "medium",
      "detector": "vector-db-detector",
      "rule_id": "rule_dep_chroma",
      "matched_name": "Chroma DB",
      "file_path": "src/example.js",
      "evidence_hint": "Detected vector database library reference on line 12: 'const chroma = new ChromaClient({'",
      "recommended_review": "Ensure persistent database directories are located in secure environments. Block unauthorized exports."
    },
    {
      "finding_id": "find_vector_xakr4fey",
      "category": "Vector DB",
      "severity": "medium",
      "detector": "vector-db-detector",
      "rule_id": "rule_dep_chroma",
      "matched_name": "Chroma DB",
      "file_path": "src/example.js",
      "evidence_hint": "Detected vector database library reference on line 17: 'console.log(`Processing ${input} with OpenAI and Chroma...`);'",
      "recommended_review": "Ensure persistent database directories are located in secure environments. Block unauthorized exports."
    }
  ],
  "recommended_review_actions": []
}