{
  "schema_version": "0.8.0",
  "diff_id": "diff_fcad5285",
  "generated_at": "2026-05-21T19:28:40.016Z",
  "baseline_run_id": "run_2026-05-21T19-28-39-913Z_fa99",
  "current_run_id": "run_2026-05-21T19-28-40-011Z_8b17",
  "summary": {
    "total_baseline": 11,
    "total_current": 11,
    "added_count": 0,
    "removed_count": 0,
    "changed_count": 0,
    "unchanged_count": 11
  },
  "added_findings": [],
  "removed_findings": [],
  "changed_findings": [],
  "unchanged_findings": [
    {
      "finding_id": "find_env_mpar29dr",
      "rule_pack_version": "v1",
      "category": "AI Credential",
      "detection_category": "config_signal",
      "severity": "high",
      "confidence": "high",
      "detector": "env-var-detector",
      "detector_id": "env_var_match",
      "signal_type": "config_signal",
      "evidence_kind": "text_pattern",
      "rule_id": "rule_env_openai",
      "matched_name": "OPENAI_API_KEY",
      "file_path": ".env.example",
      "evidence_hint": "Detected environment variable usage on line 6: 'OPENAI_API_KEY=your-openai-api-key-here'",
      "governance_relevance": "High risk of credential leakage for proprietary AI provider.",
      "recommended_review": "Never hardcode API keys. Verify that this key is supplied securely at runtime via secrets manager."
    },
    {
      "finding_id": "find_env_u2ielx8w",
      "rule_pack_version": "v1",
      "category": "AI Credential",
      "detection_category": "config_signal",
      "severity": "high",
      "confidence": "high",
      "detector": "env-var-detector",
      "detector_id": "env_var_match",
      "signal_type": "config_signal",
      "evidence_kind": "text_pattern",
      "rule_id": "rule_env_anthropic",
      "matched_name": "ANTHROPIC_API_KEY",
      "file_path": ".env.example",
      "evidence_hint": "Detected environment variable usage on line 7: 'ANTHROPIC_API_KEY=placeholder-value-for-anthropic-key'",
      "governance_relevance": "High risk of credential leakage for proprietary AI provider.",
      "recommended_review": "Ensure API key is removed from repository commits immediately."
    },
    {
      "finding_id": "find_dep_mxjqw9js",
      "rule_pack_version": "v1",
      "category": "AI SDK",
      "detection_category": "provider_sdk",
      "severity": "medium",
      "confidence": "high",
      "detector": "dependency-detector",
      "detector_id": "dep_pkg_match",
      "signal_type": "provider_sdk",
      "evidence_kind": "dependency",
      "rule_id": "rule_dep_openai",
      "matched_name": "openai",
      "file_path": "package.json",
      "evidence_hint": "Detected 'openai': '^4.20.0' in package.json dependencies list.",
      "governance_relevance": "Direct usage of proprietary LLM provider via official SDK.",
      "recommended_review": "Verify usage complies with company data privacy policy. Ensure no proprietary data is sent to external LLMs without explicit authorization."
    },
    {
      "finding_id": "find_dep_cmqxcrt0",
      "rule_pack_version": "v1",
      "category": "AI Framework",
      "detection_category": "orchestration_framework",
      "severity": "medium",
      "confidence": "high",
      "detector": "dependency-detector",
      "detector_id": "dep_pkg_match",
      "signal_type": "orchestration_framework",
      "evidence_kind": "dependency",
      "rule_id": "rule_dep_langchain",
      "matched_name": "langchain",
      "file_path": "package.json",
      "evidence_hint": "Detected 'langchain': '^0.0.198' in package.json dependencies list.",
      "governance_relevance": "LangChain usage indicates complex LLM workflows and chaining.",
      "recommended_review": "LangChain pipelines dynamically construct chains. Trace all active prompts and integrations to ensure there are no un-monitored model connections."
    },
    {
      "finding_id": "find_prompt_dst1ps5j",
      "rule_pack_version": "v1",
      "category": "AI Prompt Artifact",
      "detection_category": "prompt_asset",
      "severity": "low",
      "confidence": "high",
      "detector": "prompt-file-detector",
      "detector_id": "prompt_path_match",
      "signal_type": "prompt_asset",
      "evidence_kind": "filename",
      "rule_id": "rule_prompt_artifact",
      "matched_name": "system.prompt.md",
      "file_path": "prompts/system.prompt.md",
      "evidence_hint": "Prompt artifact matched pattern: '\\.(prompt|prompts|system-prompt)\\.(md|txt|json|yaml)$' (File name: 'system.prompt.md')",
      "governance_relevance": "Explicit prompt engineering artifact.",
      "recommended_review": "Review prompt content for bias, safety, and proprietary data."
    },
    {
      "finding_id": "find_dep_vuf9qazw",
      "rule_pack_version": "v1",
      "category": "AI Framework",
      "detection_category": "orchestration_framework",
      "severity": "medium",
      "confidence": "high",
      "detector": "dependency-detector",
      "detector_id": "dep_requirements_match",
      "signal_type": "orchestration_framework",
      "evidence_kind": "dependency",
      "rule_id": "rule_dep_llamaindex",
      "matched_name": "llama-index",
      "file_path": "requirements.txt",
      "evidence_hint": "Detected 'llama-index' on line 2 of requirements.txt: 'llama-index>=0.8.0'",
      "governance_relevance": "LlamaIndex usage indicates RAG (Retrieval-Augmented Generation) patterns.",
      "recommended_review": "LlamaIndex connects files to LLMs. Audit all document parsing pipelines and local index stores to prevent leaking restricted intellectual property."
    },
    {
      "finding_id": "find_dep_lttu387g",
      "rule_pack_version": "v1",
      "category": "Vector DB",
      "detection_category": "rag_vector",
      "severity": "medium",
      "confidence": "high",
      "detector": "dependency-detector",
      "detector_id": "dep_requirements_match",
      "signal_type": "rag_vector",
      "evidence_kind": "dependency",
      "rule_id": "rule_dep_chroma",
      "matched_name": "chromadb",
      "file_path": "requirements.txt",
      "evidence_hint": "Detected 'chromadb' on line 3 of requirements.txt: 'chromadb==0.4.15'",
      "governance_relevance": "Commonly used for local/embedded vector storage.",
      "recommended_review": "Ensure persistent database directories are located in secure environments. Block unauthorized exports."
    },
    {
      "finding_id": "find_env_wzgg1z15",
      "rule_pack_version": "v1",
      "category": "AI Credential",
      "detection_category": "config_signal",
      "severity": "high",
      "confidence": "high",
      "detector": "env-var-detector",
      "detector_id": "env_var_match",
      "signal_type": "config_signal",
      "evidence_kind": "text_pattern",
      "rule_id": "rule_env_openai",
      "matched_name": "OPENAI_API_KEY",
      "file_path": "src/example.js",
      "evidence_hint": "Detected environment variable usage on line 5: 'const apiKey=proc...[REDACTED]'",
      "governance_relevance": "High risk of credential leakage for proprietary AI provider.",
      "recommended_review": "Never hardcode API keys. Verify that this key is supplied securely at runtime via secrets manager."
    },
    {
      "finding_id": "find_vector_xep8qstz",
      "rule_pack_version": "v1",
      "category": "Vector DB",
      "detection_category": "rag_vector",
      "severity": "medium",
      "confidence": "high",
      "detector": "vector-db-detector",
      "detector_id": "vector_lib_reference",
      "signal_type": "rag_vector",
      "evidence_kind": "text_pattern",
      "rule_id": "rule_dep_chroma",
      "matched_name": "Chroma DB",
      "file_path": "src/example.js",
      "evidence_hint": "Detected vector database library reference on line 2: 'import { ChromaClient } from 'chromadb';'",
      "governance_relevance": "Commonly used for local/embedded vector storage.",
      "recommended_review": "Ensure persistent database directories are located in secure environments. Block unauthorized exports."
    },
    {
      "finding_id": "find_vector_tsy1x6r6",
      "rule_pack_version": "v1",
      "category": "Vector DB",
      "detection_category": "rag_vector",
      "severity": "medium",
      "confidence": "high",
      "detector": "vector-db-detector",
      "detector_id": "vector_lib_reference",
      "signal_type": "rag_vector",
      "evidence_kind": "text_pattern",
      "rule_id": "rule_dep_chroma",
      "matched_name": "Chroma DB",
      "file_path": "src/example.js",
      "evidence_hint": "Detected vector database library reference on line 12: 'const chroma = new ChromaClient({'",
      "governance_relevance": "Commonly used for local/embedded vector storage.",
      "recommended_review": "Ensure persistent database directories are located in secure environments. Block unauthorized exports."
    },
    {
      "finding_id": "find_vector_xouwu0ts",
      "rule_pack_version": "v1",
      "category": "Vector DB",
      "detection_category": "rag_vector",
      "severity": "medium",
      "confidence": "high",
      "detector": "vector-db-detector",
      "detector_id": "vector_lib_reference",
      "signal_type": "rag_vector",
      "evidence_kind": "text_pattern",
      "rule_id": "rule_dep_chroma",
      "matched_name": "Chroma DB",
      "file_path": "src/example.js",
      "evidence_hint": "Detected vector database library reference on line 17: 'console.log(`Processing ${input} with OpenAI and Chroma...`);'",
      "governance_relevance": "Commonly used for local/embedded vector storage.",
      "recommended_review": "Ensure persistent database directories are located in secure environments. Block unauthorized exports."
    }
  ],
  "recommended_review_actions": []
}